Image,MLS#,Address,City,Status,Status Timestamp,Prop Type,Acres,SQFT Total,SQFTAbvGr,Rooms,Beds,Baths,Garage/Park,Built,DOM,Association Amenities,Assessed Value,Driveway Type,Price,Property Tax,Zoning,Handicap Features,Energy Features,HOA Fee Amount,HOA YN,HOA Fee Frequency,Bank Owned or Controlled Property YN,High School,Elementary School,Nearby Amenities,Swimming Pool YN,Direct Waterfront YN,Waterfront Description,Price Change Timestamp,Cooling,Heat Type,Heat Fuel Type,Intermediate School,Exterior Features,Middle Jr High School,Pool Description,Estimated Annual Heat Co,Photo
https://smartmls-assets.cdn-connectmls.com/pics/DD94DEC9A4EEAE7EE053D501100AE043/HD_1651003018467_170357537_1.JPEG,170357537,"180  Park St. , Unit# 304",New Canaan,ACTV,12/01/2020,CO,,1236,1236,4,2,2/0,"2 Car Garage, Assigned Parking, Parking Garage, Security",2020,1212,"Club House, Elevator, Exercise Room/Health Club, Guest Parking, Private Rec Facilities, Putting Green",798490,,1555000,15123,APT,,"Programmable Thermostat, Thermopane Windows",1086,Yes,Monthly,No,New Canaan,South,"Library, Paddle Tennis, Park, Private Rec Facilities, Public Pool, Public Rec Facilities, Tennis Courts",No,No,Not Applicable,,"Central Air, Zoned","Gas on Gas, Zoned",Natural Gas,,"Balcony, French Doors, Garden Area, Grill, Lighting, Sidewalk, Terrace",Saxe Middle,,,
https://smartmls-assets.cdn-connectmls.com/pics/1263D517D522B09BE0631401100AB074/HD_1709064178264_77_Sunset_Ln_Unit_2_Ridgefield_large_022_030_019_1500x1000_72dpi.JPEG,24000039,"77  Sunset Ln. , Unit# 2",Ridgefield,ACTV,03/19/2024,CO,,3148,3148,8,2,2/2,"2 Car Garage, Attached Garage",2016,27,Club House,782880,,1325000,20206,MFDD,,"Generator, Thermopane Windows",529,Yes,Monthly,No,Per Board of Ed,Per Board of Ed,"Golf Course, Health Club, Library, Medical Facilities, Park, Public Rec Facilities, Shopping/Mall, Tennis Courts",No,No,,03/19/2024,"Ceiling Fans, Central Air, Zoned",Hot Air,Natural Gas,Per Board of Ed,,Per Board of Ed,,,
https://smartmls-assets.cdn-connectmls.com/pics/12EEDFA4E3802630E063D501100AB63B/HD_1709666609737_54CE9F9C_46E3_403E_9221_99C0F1C855C0.JPEG,24001571,"95  Middle Tpke. W., Unit# APT B4",Manchester,ACTV,03/05/2024,CO,,850,850,4,2,1/0,"1 Car Garage, Detached Garage",1939,23,,54000,,169900,2009,Residential,,,436,Yes,Monthly,No,Per Board of Ed,Per Board of Ed,,No,No,,,Window Unit,Hot Water,Oil,,,,,,
https://smartmls-assets.cdn-connectmls.com/pics/F90247D5DC6DEB31E0531401100A7EB4/HD_1681170607271_170560408_1.JPEG,170560408,"23  Sallys Way. , Unit# 26",Shelton,ACTV,04/10/2023,CO,,1551,1551,5,2,2/1,"1 Car Garage, Attached Garage, Paved",2023,355,,0,,519000,0,IA-2,,"Extra Insulation, Programmable Thermostat, Ridge Vents, Thermopane Windows",157,Yes,Monthly,No,Shelton,Long Hill,,No,No,Not Applicable,,Central Air,Gas on Gas,Gas In Street,,"Deck, Porch",,,,
https://smartmls-assets.cdn-connectmls.com/pics/EADCCFC5024DE696E053D501100A13B5/HD_1665606885190_170527369_1.JPEG,170527369,"22  West Main St. , Unit# 10",Groton,ACTV,10/12/2022,CO,,1750,1750,6,2,2/1,"0 Car Garage, 2 Total Spaces, Assigned Parking, Off Street Parking",2022,532,Elevator,0,,1950000,0,MDD,"32' Minimum Door Widths, Exterior Curb Cuts, Hallways 36+ Inches Wide","Extra Insulation, Generator, Programmable Thermostat, Thermopane Windows",954,Yes,Monthly,No,Fitch Senior,Per Board of Ed,"Golf Course, Library, Medical Facilities, Paddle Tennis, Private Rec Facilities, Public Rec Facilities, Shopping/Mall, Tennis Courts",No,Yes,"Direct Waterfront, River, Dock or Mooring, View",,"Central Air, Zoned","Hydro Air, Zoned",Propane,,"Balcony, Covered Deck, Lighting, Sidewalk",Per Board of Ed,,,
